{
  "$schema": "http://json-schema.org/draft-07/schema#",
  "title": "Corrective Action",
  "description": "Corrective action record linked to a Safety Finding",
  "version": "2.1.0",
  "type": "object",
  "required": ["id", "finding_id", "legal_basis", "date_assigned", "description", "responsible_party", "due_date", "status"],
  "properties": {
    "id": { "type": "string", "pattern": "^CA-[0-9]{4}-[0-9]{4}$" },
    "finding_id": { "type": "string", "pattern": "^FIND-[0-9]{4}-[0-9]{4}$" },
    "legal_basis": { "type": "array", "items": { "type": "string" }, "minItems": 3, "description": "Applicable law articles — minimum 3 regulatory sources, inherited from linked finding" },
    "date_assigned": { "type": "string", "format": "date" },
    "description": { "type": "string" },
    "responsible_party": { "type": "string" },
    "agent_id": { "$ref": "common.schema.json#/definitions/agent_id", "description": "Optional (v2.1): agent attribution. Not required because legacy records predate agent attribution and carry no audit_trail to derive it from (zero-fabrication rule)." },
    "workflow_id": { "$ref": "common.schema.json#/definitions/workflow_id", "description": "Optional (v2.1): workflow execution reference. Corrective actions are tracked per finding, not per workflow dispatch — never invent an ID to satisfy this field." },
    "due_date": { "type": "string", "format": "date" },
    "completed_date": { "type": "string", "format": "date" },
    "status": { "type": "string", "enum": ["assigned", "in-progress", "completed", "verified", "overdue"] },
    "verification_note": { "type": "string" }
  }
}
